{
  "$schema": "https://json-schema.org/draft/2020-12/schema",
  "$id": "https://accounts.aspectlylabs.com/v1/contract/schema.json",
  "title": "Orvilo auth broker contract",
  "type": "object",
  "additionalProperties": false,
  "required": ["name", "version", "origins", "broker", "goApi", "desktop", "client", "authority"],
  "properties": {
    "$schema": { "type": "string" },
    "name": { "const": "orvilo-auth-broker" },
    "version": { "const": 1 },
    "origins": {
      "type": "object", "additionalProperties": false,
      "required": ["broker", "product", "api"],
      "properties": {
        "broker": { "const": "https://accounts.aspectlylabs.com" },
        "product": { "const": "https://orvilo.aspectlylabs.com" },
        "api": { "const": "https://api.aspectlylabs.com" }
      }
    },
    "broker": {
      "type": "object", "additionalProperties": false,
      "required": ["googleStartPath", "googleCallbackPath", "desktopCompletionPath", "desktopAttemptPath", "desktopCompletePath", "contractPath"],
      "properties": {
        "googleStartPath": { "const": "/oauth/google" },
        "googleCallbackPath": { "const": "/oauth/google/callback" },
        "desktopCompletionPath": { "const": "/login" },
        "desktopAttemptPath": { "const": "/v1/desktop/google/attempt" },
        "desktopCompletePath": { "const": "/v1/desktop/google/complete" },
        "contractPath": { "const": "/v1/contract" }
      }
    },
    "goApi": {
      "type": "object", "additionalProperties": false,
      "required": ["desktopAttemptPath", "desktopCompletePath", "desktopRedeemPath"],
      "properties": {
        "desktopAttemptPath": { "const": "/api/desktop-google/attempt" },
        "desktopCompletePath": { "const": "/api/desktop-google/complete" },
        "desktopRedeemPath": { "const": "/api/desktop-handoff/redeem" },
        "desktopIdentityRedeemPath": { "const": "/api/desktop-identity/redeem" }
      }
    },
    "desktop": {
      "type": "object", "additionalProperties": false,
      "required": ["callbackUrl", "queryParameters", "pkceMethod", "bearerAllowedInCallback"],
      "properties": {
        "callbackUrl": { "const": "orvilo://auth/callback" },
        "queryParameters": { "type": "array", "prefixItems": [{ "const": "code" }, { "const": "state" }], "items": false, "minItems": 2, "maxItems": 2 },
        "pkceMethod": { "const": "S256" },
        "bearerAllowedInCallback": { "const": false }
      }
    },
    "client": {
      "type": "object", "additionalProperties": false,
      "required": ["clerkExchangePath", "guestPath", "logoutPath", "mePath", "websocketPath", "guestTokenPrefix", "guestWorkspaceAccess", "guestWebsocketAccess"],
      "properties": {
        "clerkExchangePath": { "const": "/auth/clerk" },
        "guestPath": { "const": "/auth/guest" },
        "logoutPath": { "const": "/auth/logout" },
        "mePath": { "const": "/api/me" },
        "websocketPath": { "const": "/ws" },
        "guestTokenPrefix": { "const": "ovg_" },
        "guestWorkspaceAccess": { "const": false },
        "guestWebsocketAccess": { "const": false }
      }
    },
    "authority": {
      "type": "object", "additionalProperties": false,
      "required": ["identity", "orviloSession", "oneTimeGrant", "brokerPersistence"],
      "properties": {
        "identity": { "const": "clerk" },
        "orviloSession": { "const": "go-api" },
        "oneTimeGrant": { "const": "go-api" },
        "brokerPersistence": { "const": "none" }
      }
    }
  }
}
